{
  "schemaVersion": 1,
  "generatedAt": "2026-06-27T07:18:46.134Z",
  "meta": {
    "brandLabel": "Joesh's AI Briefing",
    "dateLabel": "Sat · Jun 27 2026",
    "editionLine": "EDITION No.422 · SYNCED 16:18 JST",
    "greeting": "Good morning, Joesh.",
    "intro": "Seven stories today — four global, three Japan. The lead is Engram, an eight-month-old SF startup that just emerged from stealth with $98M at a $600M valuation betting that organizational memory, not bigger models, is enterprise AI's next unlock. Alongside: a new open agent-discovery standard, a classified-systems breach that forced Anthropic offline, and Japan's most ambitious AI commitment in history.",
    "briefingTitle": "Memory Is the New Moat — and Japan Is Betting $2.3T on Catching Up",
    "summary": "Token efficiency is emerging as 2026's defining enterprise AI battleground: Engram's $98M stealth launch argues that persistent organizational memory — not bigger models — is what makes AI actually useful at scale, and it already has Microsoft, Notion, and Harvey paying to prove it. At the infrastructure layer, eleven companies including Google and Microsoft published the ARD specification, a runtime agent-discovery standard that could make agentic ecosystems genuinely interoperable without hand-wired integrations — notably without OpenAI or Anthropic. Anthropic's Mythos model meanwhile crystallized the dual-use dilemma in the starkest terms yet: it reportedly cracked nearly all classified US government systems in hours during a red-team test, triggering an emergency access shutdown and a White House cybersecurity executive order. Japan is responding to the accelerating AI threat landscape with its largest-ever policy commitment — a ¥370 trillion 14-year investment plan earmarking ¥101.6 trillion for AI and semiconductors — while simultaneously revising its AI Basic Plan mid-year to name Mythos-class models as a new cyberrisk. The gap between Japan's ambitions and its current execution — flat VC, no frontier model, Rapidus still years from production volume — remains the central tension to watch.",
    "footerLeft": "Joesh's AI Briefing — Sat Jun 27 2026",
    "footerRight": "7 stories · 18 sources"
  },
  "gaps": [
    {
      "label": "Foundation Models",
      "jp": 18,
      "frontier": 95,
      "note": "Japan has no internationally competitive frontier model. Sakana AI runs interesting evolutionary experiments; NEC and Fujitsu have enterprise LLMs; but nothing approaches GPT/Claude/Gemini capability or global reach. The gap is widening as frontier labs accelerate into reasoning-class systems."
    },
    {
      "label": "AI VC Investment",
      "jp": 12,
      "frontier": 95,
      "note": "Japan's AI VC is structurally flat in 2026 while the US captures ~88% of global AI funding per Crunchbase. Risk aversion, thin exit markets, and limited LP appetite for deep-tech keep Japanese AI rounds small and scarce — a structural gap, not a cyclical one."
    },
    {
      "label": "Semiconductor Mfg (Advanced)",
      "jp": 32,
      "frontier": 90,
      "note": "Rapidus targets 2nm production by 2027 but has no revenue-generating volume today. TSMC Kumamoto adds domestic capacity at 28nm/16nm nodes — not frontier. METI's ¥150B Rapidus earmark within a ¥1.23T FY2026 semiconductor envelope is real capital, but execution risk is high."
    },
    {
      "label": "AI Talent Density",
      "jp": 22,
      "frontier": 95,
      "note": "Brain drain to US labs continues. Japan's top AI researchers largely publish from US institutions. The ¥370T plan includes school-level AI education investment, but the pipeline is a decade-long project, not a near-term fix."
    },
    {
      "label": "Physical AI / Robotics",
      "jp": 55,
      "frontier": 75,
      "note": "Japan's strongest relative position. Decades of factory automation data, deep robotics hardware expertise, and PM Takaichi's explicit 'physical AI' strategy make this the most credible gap-closing opportunity — if software talent and domestic compute can follow. Jensen Huang agrees the category is critical."
    },
    {
      "label": "AI Policy / Governance",
      "jp": 52,
      "frontier": 65,
      "note": "Japan's AI Promotion Act (May 2025) and AI Basic Plan (Dec 2025, revised Jun 2026) show adaptive governance — Tokyo revised its plan mid-year, unusually fast by government standards. The IP Strategic Program now targets GenAI copyright frameworks. Less rigid than EU AI Act, faster than most Asian peers."
    }
  ],
  "items": [
    {
      "id": "g1",
      "region": "global",
      "cat": "funding",
      "source": "CNBC / PR Newswire",
      "time": "Jun 23 2026",
      "headline": "Engram Emerges from Stealth with $98M at $600M Valuation — 13 People, Andrej Karpathy Angel, Claiming 100× Token Reduction",
      "dek": "The 8-month-old SF startup backed by General Catalyst, Kleiner Perkins, and Sequoia argues enterprises waste millions re-teaching AI the same organizational context on every query. Its 'learned memory layer' compresses institutional knowledge into compact, reusable model memory.",
      "analysis": {
        "happening": "Engram, founded last October out of Stanford's AI lab by computational neuroscience PhD Dan Biderman, came out of stealth on June 23 with $98 million in seed funding at a $600 million valuation. General Catalyst, Kleiner Perkins, and Sequoia co-led; Factory, Modern Capital, Amplify Partners, and Neo also participated. Angel investors include OpenAI co-founder Andrej Karpathy, Wiz co-founder Assaf Rappaport, and Berkeley AI Research co-director Pieter Abbeel. The 13-person team is building a 'learned memory layer' — an architecture that separates reasoning from memory, letting AI continuously absorb organizational knowledge rather than re-reading documents on every query. The company claims its models match or outperform frontier models while consuming up to 100× fewer tokens. Paying customers already include Microsoft (testing inside Microsoft 365), Notion, and legal AI startup Harvey.",
        "now": "The timing lands at exactly the moment large enterprises are receiving their first AI inference invoices at scale and not liking the numbers. As more sophisticated agentic models drive token usage sharply higher, the ROI math on frontier-model usage in enterprise workflows is turning negative. Engram's pitch — organizational memory as a proprietary asset owned by the enterprise, not the model provider — addresses cost and control simultaneously. The key caveat: CEO Dan Biderman explicitly acknowledges Engram's models are not 'absolutely better' than frontier models; they specialize, trading breadth for depth in specific organizational contexts. Whether that specialization becomes a defensible moat or gets commoditized by frontier labs adding cheaper native memory layers is the central open question.",
        "future": "Watch whether Microsoft's partnership deepens into a distribution deal — the Azure compute commitment and Microsoft 365 integration path could give Engram scale no other memory-layer startup could match. The competitive threat is OpenAI, Anthropic, and Google building persistent memory natively into their own products, which would commoditize the category. The $98M with 13 people means capital is going almost entirely to compute and key hires — Engram must grow faster than the frontier labs' memory roadmaps catch up. For builders: 'memory as infrastructure' is now a fundable thesis at Series seed — adjacent plays in domain-specific memory compression, RAG replacement, and enterprise knowledge graphs may be similarly ripe."
      },
      "sources": [
        {
          "name": "CNBC",
          "title": "AI memory startup focused on cutting token costs raises $98 million",
          "url": "https://www.cnbc.com/2026/06/23/ai-memory-startup-focused-on-cutting-token-costs-raises-98-million.html"
        },
        {
          "name": "PR Newswire",
          "title": "Engram Launches with $98M to Build AI That Actually Knows Your Organization",
          "url": "https://www.prnewswire.com/news-releases/engram-launches-with-98m-to-build-ai-that-actually-knows-your-organization-302807126.html"
        },
        {
          "name": "Tech Startups",
          "title": "Engram raises $98 million to help companies lower AI token costs with smarter memory models",
          "url": "https://techstartups.com/2026/06/23/engram-raises-98-million-to-help-companies-lower-ai-token-costs-with-smarter-memory-models/"
        },
        {
          "name": "Calcalist Tech",
          "title": "AI startup Engram raises $98 million at $600 million valuation with just 13 employees",
          "url": "https://www.calcalistech.com/ctechnews/article/skoqbrumze"
        }
      ],
      "tags": [
        "engram",
        "enterprise-ai",
        "memory-layer",
        "general-catalyst",
        "kleiner-perkins",
        "sequoia",
        "andrej-karpathy",
        "token-efficiency",
        "stealth-launch",
        "san-francisco"
      ]
    },
    {
      "id": "g2",
      "region": "global",
      "cat": "launches",
      "source": "Google Developers Blog / Microsoft",
      "time": "Jun 17 2026",
      "headline": "ARD Goes Live: 11 Companies Publish Open Spec for AI Agent Tool Discovery — GitHub Ships Agent Finder on Day One",
      "dek": "Agentic Resource Discovery (ARD) lets AI agents find tools, MCP servers, and other agents at runtime via machine-readable catalogs, ending the need for hard-wired integrations. OpenAI and Anthropic are conspicuously absent from the coalition.",
      "analysis": {